{
  "$schema": "../../../schemas/device-definition.schema.json",
  "schemaVersion": 1,
  "id": "logitech.g913-tkl-receiver",
  "displayName": "Logitech G913 TKL (Receiver)",
  "vendor": "Logitech",
  "enabled": true,
  "match": {
    "transport": "hid",
    "vendorId": 1133,
    "productId": 50501,
    "usagePage": 65280,
    "usage": 2,
    "interface": "MI_02"
  },
  "protocol": {
    "kind": "logitech.hidpp2",
    "options": {
      "softwareId": 10,
      "deviceIndexes": [1, 255, 2, 3, 4, 5, 6],
      "batteryFeatures": ["0x1001", "0x1000", "0x1004"]
    }
  },
  "polling": {
    "intervalSeconds": 60,
    "timeoutSeconds": 2,
    "retry": {
      "maxAttempts": 2,
      "backoffMs": 300
    }
  }
}
